<?xml version="1.0" encoding="UTF-8"?>

<!ELEMENT biblioteca (libro)+>
<!ELEMENT libro (titulo,autor+,editorial,isbn,precio)+>
<!ATTLIST libro numero CDATA #REQUIRED>

<!ELEMENT titulo (#PCDATA)>
<!ELEMENT autor (#PCDATA)>
<!ELEMENT editorial (#PCDATA)>
<!ELEMENT isbn (#PCDATA)>
<!ELEMENT precio (#PCDATA)>